{
  "api_version": "llm.temporal/v1",
  "operation_key": "fork-positive-temperature",
  "context": {"tenant": "acme", "project": "claims", "actor": "workflow:claim-1"},
  "parent": "ckp_v1.parent",
  "append": [],
  "settings_patch": {"temperature": {"set": "0.000000000000000001"}},
  "cache": {"max_age_seconds": 60, "variant": 1}
}
